how much is an overdraft fee for bank,en_US,oos
why are exponents preformed before multiplication in the order of operations,en_US,oos
what size wipers does this car take,en_US,oos
where is the dipstick,en_US,oos
how much is 1 share of aapl,en_US,oos
how is glue made,en_US,oos
any headlines from my area,en_US,oos
what is the largest state in the us,en_US,oos
what is the current market trend,en_US,oos
what is the most popular airline,en_US,oos
what is the formula for the circumference of a circle,en_US,oos
what are some ways to reduce spending,en_US,oos
what time does the louvre open,en_US,oos
are there any local stations covering the moral march in raleigh in februaryu,en_US,oos
how many planets have we discovered,en_US,oos
how do i change my billing address,en_US,oos
how do i open an online line of credit,en_US,oos
how do i remove a coffee blemish,en_US,oos
how expensive is an apple share,en_US,oos
where can i find the cruise control on my kia sportage 2010,en_US,oos
how many sides are in a hexagon,en_US,oos
how fast does an airplane travel,en_US,oos
is it worth investing in target,en_US,oos
i need to speak to customer service regarding my flight,en_US,oos
how long do wire transfers take,en_US,oos
what are some deals on amazon,en_US,oos
what city is the super bowl,en_US,oos
what trees change color in autumn,en_US,oos
do people prefer summer over fall,en_US,oos
how long is winter,en_US,oos
what were some of ben franklin's notable accomplishments,en_US,oos
where was john denver born,en_US,oos
where did abraham lincoln live,en_US,oos
when was kobe bryant born,en_US,oos
who's toledo's starting point guard for the next game,en_US,oos
how many players are on the chicago bulls,en_US,oos
who is the coach of the chicago bulls,en_US,oos
when do the utah jazz play next,en_US,oos
what other nations were involved in the chinese trade war,en_US,oos
what years has korea been at war,en_US,oos
when was the theory of evolution first considered,en_US,oos
who formulated the theory of relativity,en_US,oos
what stage of evolution am i,en_US,oos
what other personality type is most compatible with infjs,en_US,oos
what does my personality mean,en_US,oos
what's the most dominant scale in bluegrass,en_US,oos
what year was saxaphone first played,en_US,oos
which piano is best for classical,en_US,oos
is k-12 education required outside of the united states,en_US,oos
what are the benefits of completing college,en_US,oos
are you able to answer algebra equations,en_US,oos
can you help me study for a history exam,en_US,oos
how many points per game is lebron james averaging this season,en_US,oos
what team does eli mannign play for,en_US,oos
get me dwight howard shooting average,en_US,oos
can you list me tiger wood's stats,en_US,oos
what's the runtime of all the lord of the rings movies combined,en_US,oos
which character is the most famous from titanic,en_US,oos
how many oscars did star wars films win,en_US,oos
what year was shawshank redemption released,en_US,oos
which marvel character has appeared in the most movies,en_US,oos
when's the next movie starring thor set to come out,en_US,oos
who was the first capcom character,en_US,oos
are any justice league movies coming out,en_US,oos
can you tell me something about the nfl,en_US,oos
please explain the catch rule to me,en_US,oos
is there overtime in college football,en_US,oos
when did the mls start,en_US,oos
what's the best price on super smash bros ultimate right now,en_US,oos
what is the highest earning game on atari,en_US,oos
when is the next nintendo direct,en_US,oos
when was nintendo created,en_US,oos
please find the capital of pakistan and its population,en_US,oos
how many people live in taiwan,en_US,oos
what are some of picasso's most famous works,en_US,oos
what are van gogh's best pieces,en_US,oos
where can i see art,en_US,oos
when did camus die,en_US,oos
how much money does radiohead earn a year,en_US,oos
who is radiohead,en_US,oos
what's the biggest saas marketing company in the united states,en_US,oos
how do i start my own marketing firm,en_US,oos
how can i get involved in restaurant marketing,en_US,oos
what is saas marketing,en_US,oos
what do you call someone who was born in segovia,en_US,oos
what is rhineland,en_US,oos
who is the scariest character in start trek,en_US,oos
who is the current captain of this ship,en_US,oos
what year was star trek released,en_US,oos
when was toyota created,en_US,oos
who are some notable alumni of ucsd,en_US,oos
what is the next football game,en_US,oos
how many students attend ucsb,en_US,oos
when do classes start,en_US,oos
how can i become an aerospace engineer,en_US,oos
what percentage of species display cold blooded traits,en_US,oos
what does it mean to be an alpha male,en_US,oos
what animals have alpha males,en_US,oos
why do males want to be alpha,en_US,oos
what's the average battery life of an android phone,en_US,oos
